	0	1
206	有人投国际能源与环境工程(IJEEE)吗,为什么关闭投稿了	InternationalJournalofEnergyandEnvironmentalEngineering,Springer旗下EI,提交返修不久后发现投稿网站首页说暂时关闭投稿,登录上去没有投稿页面了,稿件进度也看不到,不知道什么原因,现在要怎么办?
207	校稿求助	Youraicleisbeingprocessedasaregularitemtobeincludedinaregularissue.Pleaseconfirmifthisiscorrectorifyouraicleshouldbepublishedinaspecialissueusingtheresponsesbelow.文章要校稿,有没有知道,这个是啥意思?爱唯思旗下期刊
208	文章接收后,怎么上传cover image?	爱思唯尔旗下期刊,已接收,现在上传coverimage,怎么上传?第一次中刊,请大佬指教。捕获1.GIF
209	投的一篇IEEE Trans TVT论文(Correspondence短文)	有虫友知道这个期刊的withassociateeditor状态多久出结果?两周了...这个状态是审稿人的意见全部回到ae那了吗?还是ae又找了个审稿人,在仲裁?
210	求最新的corrosion science 参考文献模板,ENDNOTE,	求最新的corrosionscience参考文献模板,用的endnote,
211	submitted to journal后一直没有变化	早先往AnalyticaChimicaActa投的一篇文章被拒后应编辑要求可以改后重投,改好后4月26日重新投稿,到现在一直处在submittedtojournal状态,也没有文章号,记得以前Elsevier的杂志投稿后都是很快分配文章号,现在怎么这么慢了,这是正常现象吗?要不要给编辑发个邮件问下呢?
212	SCI期刊要求写Dete in Brief 和method aicel,应该应该怎么写?	SCL期刊要求提供DateinBrief,想请教一下学术大佬们,是要放上原始数据吗,使用Excel吗,还要求提供一份methodaicel,这个内容应该写什么,是写投稿的全部实验方法吗,还是写投稿文章中创新一点的方法比较好,肯请学术大佬们帮忙解答一下,非常感谢
213	EURASIP Journal on Wireless Communications and Networking投稿	请问有没有投稿EURASIPJournalonWirelessCommunicationsandNetworking的,进度如何?
214	高分子通报	投稿高分子通报,我近四个月没消息了。从官网上这两年收录的文章页脚看到的,从收稿日期到改回日期,这之间的时间差距几乎都是七八月以上,有的甚至是一年。请问哪位朋友投稿过的此期刊的,真是如此之慢吗?
215	国内的中文核心期刊会有支付稿酬?	请教各位虫友,国内的中文核心期刊会有支付稿酬嘛?
216	请问nature旗下新刊物communications physics如何?影响因子何时可出?	有一篇论文投过去了,要求修改,现在修改上交了。这个刊物是5月份投naturecommunications没通过建议转投的,为了怕麻烦想先投试试,结果审稿意见还不错。现在已经改完再投了,但又觉得这个刊物影响因子还没出。想了解按照新期刊开始到影响因子出来大概要多久啊?这个刊物如何呢,是否能定位1区呢?职称评定什么的很急哎~,请大神们给一点建议,
217	第一次投文章,录用为增刊,想撤稿,请教虫友们怎样给编辑部写信比较好	第一次投文章,录用为增刊,想撤稿,请教虫友们怎样给编辑部写信比较好
218	一审结束,编辑在信里只给了一个审稿人的意见,另一个说是见附件,但是找不到任何附件	一审结束,编辑在信里只给了一个审稿人的意见,另一个说是见附件,但是找不到任何附件
219	中国酿造投稿求助	中国酿造投稿求助
220	低共熔溶剂	有没有做低共熔溶剂的朋友,这个溶剂太粘稠了,想请教一下各位,该怎么准确量取低共熔溶剂体积啊
221	状态显示Status: Not Yet Acknowledged	大家知道这个状态是什么意思吗?submitted后,显示状态显示Status:NotYetAcknowledged。然后我发现竟然还能修改。这到底是投成功了还是没有?是aps的投稿系统,pdf都还没生成呢。小白第一次投这个系统的期刊,真诚求助!有人知道吗?
222	transfer到Energy  Environmental Materials的都显示invited manuscript么?	楼主上个月投的AFM外审一个月后被拒稿,编辑提供转投选项可以投EnergyEnvironmentalMaterials。然后我们这边同意了,文章转过去以后进AuthorDashboard看到在invitedmanuscript栏下。。这是什么意思呀,转投这个期刊的文章都会变成invitedmanuscript么?
223	环境化学期刊综述好中吗?文章一共7000字,关于水处理方面的	审稿速度怎么样?容易拒稿么?求好心人解惑!
224	审稿人提出数据统一使用三个有效数字是什么意思?	投的是质谱分析类文章,第一次修改时,审稿人提出的建议是:Reponumbersin3significantdigits,e.g.,9.95,99.5,995.我的理解是文章中的数据都使用三个有效数字,可能是我看过的文献数量太少了,但是在我的认知里,没有看到过分析文章中数据以有效数字统一的,大部分是统一保留小数点位数,类似于2.33,33.33,0.22这样。我也以这个理由回复了审稿人。第二次修改时,审稿人重新提出了这个问题:Theauthorsmustreponumbersforinstanceconcentrationwith3relevantdigits.所以审稿人的意思是文章中数...
225	求各位大佬帮忙看一下大修意见	第一次投稿,希望大家可以帮忙看一下编辑与审稿人的要求,因为审稿人要求比对的算法与我所做的其实并不是太相关。编辑意见:Ihavereceivedthereviewer\'scommentsonyourpapehatareappendedbelow.Thereviewerhasadvisedthatyourmanuscriptrequiresarevisionbeforeitcanbereconsideredforpublication.Agreeingtoreviewer’scomments,Ialsobelieveitiscrucialtoreferencetheexistingworks...
226	关于自组装抗肿瘤药物纳米粒文章投哪里	各位大大好,本人小菜一枚,课题做了一个脂溶性抗肿瘤天然产物修饰后自组装成纳米颗粒,粒径140nm,对多株细胞体外抗肿瘤活性提高,体内动物实验还没做,请问这种内容投哪些期刊比较合适啊?最好补充一点什么内容好呢?求各位大大指点,万分感谢!
227	新手第一次投SCI记录贴	楼主第一次投SCI,投了一个4区OA期刊,基本靠自己,感觉走到送审都难,在网上扒了一遍网友们的投稿经历,想记录一下自己的投稿过程。每天看3遍邮箱和系统状态,焦虑死了,就是个小硕士煎熬毕业..怎么感觉也那么难,而且打听到的今年6月份毕业的情况,虽然学校一般,但是周围一打听就能说出有知道的人不能拿双证(感觉更加害怕了).22年4月20日提交(submitted)22年4月24日AE返回小修(minorrevision)22年5月8日提交小修(revisionsubmitted)22年5月12日系统显示pendingdecision(网上扒了一圈,发现要是送审的话会直接显示und...
228	Canadian Journal of Chemistry	CanadianJournalofChemistry的投稿网址打不开,有人知道它的投稿网址吗,万分感谢
229	计算机仿真	5.16投稿,11.24录用,呜呜呜,太难了
230	机床与液压投稿	投稿这个期刊一个多月了,去查询状态复审已审回,意见是空白,结果是采用,还要等多久才能知道结果呢,录用的概率大吗?
231	中央引导地方科技发展资金项目英文名称	请问各位虫友,谁的英文论文挂过中央引导地方科技发展资金项目?请问一下这个项目的官方英文名称是什么?
232	Editor Assignment Pending快一个月,求助各位!	首次投稿Springer下的Flexibleservicesandmanufacturingjournal3.12号Submitted3.14号EditorAssignmentPending然后保持这个状态至今快一个月,想问下这情况正常吗,需要催一下吗还是继续等待?
233	投稿格式咨询	想试一下农业机械学报,但是没找到它要求的文字大小,间距等这些格式要求?请问有没有了解的呢?
234	hindawi投稿系统  无法上传修稿	回来修改意见,修改好后,没有看见上传修改稿件的位置,请问是要重新投稿上传吗?还是发邮件回复修改稿?
235	nature投稿状态	4.24投稿,25送审,5.19编辑做决定,怎么一直没有消息呀
236	论文投稿求助	请问有没有不需要做实验的,实验室管理或者是教学改革方面的相对比较容易投中的SCI期刊?谢谢大家,期待得到大家的回复。
237	ACS applied Bio material	投ACSAMi转投ACSappliedBiomaterial,这个期刊让大修加重投,昨天出的最新期刊影响因子还没有,请教大家还有重投的必要吗?这个期刊会不会被SCI收录呢,ACSappliedNanomaterial已经有影响因子了,这两个期刊是不是同一年发刊的呢?
238	编辑周末休息吗	状态是awaitingdecision,周末编辑休息吗?
239	SSCI论文	请问SSCI论文四区的好发吗?一般审稿周期是三个月吗?北大国外人文社科要目总览,包含四区的吗?
240	IEEE trans. 状态变化咨询	2022.2月底投的twc,2022.6.3变成awaitingeditordecision,但现在快三周了还没出结果。如果是又新找了reviewer的话,系统的状态会有变化吗?如果没有新找,为什么这么久还是awaitingdecision
241	PNAS二审,Under Editor Review之后Pending Recommendation已经快两周了,什么情况	一审意见一个大修一个小修,按理说直接甩给两个审稿人不就得了?这是找了第三个审稿人的意思么?stagestadatependingrecommendation20210211undereditorreview20210211undereditorialboardreview20210208authorapprovedsubmission20210208preliminarymanuscriptinformationsubmitted20210207
242	这种情况该催稿询问编辑吗	我8.20投了BMCGenomics,一审还有一个礼拜就两个月了,只是9月20号系统里面显示一位审稿人意见已收到,但到现在还没收到返修意见,这种情况该邮件问编辑具体情况吗
243	状态是 Under review,但是日期一直在变动 是什么情况	请问各位大神,我6月末改稿重投后,一直显示状态underreview但是日期一直在变,是因为换了审稿人吗?
244	返修8个月,编辑三个月都没给意见,该何去何从?	投稿了一篇论文,审稿人意见回来之后编辑迟迟没有给意见,到现在已经整整三个月了,期间发邮件催过,但是助理编辑也是以“还在决定中”为理由搪塞了过去。请问大家这种情况应该怎么办呢?
245	与“optic & laser technology”相似的二区及以上的期刊有哪些?	如标题,主要是想了解一下本学科靠前的期刊,做飞秒激光微加工的新人一名。
246	frontiers系列杂志,四个审稿人,三个endorsed,另一个一直pending(未提交意见)	frontiers系列杂志,四个审稿人,三个endorsed,另一个一直pending(未提交意见)
247	ESPR催稿	请问ESPR的催稿邮箱是什么呢,投稿快两个月了,还在editorinvited
248	投稿后一个半月状态还是editor assigned想撤稿怎嘛办	请问是给编辑发完撤稿信就可以转投吗,还是状态变了或者编辑回复再转投,要是编辑迟迟不回复怎么办?
249	审稿意见:论文创新性和学术深度不足	审稿意见:论文创新性和学术深度不足
250	周末可以给国外编辑发催稿信吗	一篇文章UnderReview已经5个月了,想发一封邮件给编辑询问下进度。有个疑问,周末时间方便给外国人发邮件吗?还是等工作日再发邮件比较合适?求解答
251	请教一下,大家的教改论文一般投哪些期刊?	请教一下,大家的教改论文一般投哪些期刊?投了十个期刊都被拒了,甚至连一些很普通的一般期刊也把我拒了,哎,自信心被打击的快颓废了,救救我吧。
252	材料类文章投稿推荐	写了一篇防腐涂层的文章,主要是涂层的制备和性能测试的,求大佬推荐2区以上比较容易的期刊!!!
253	实验技术与管理初审后直接进入终审,是不是意味着录用概率很大还是凉凉了?	实验技术与管理,7月19日投稿,8月5月通过初审,现在未送外审直接进入终审阶段,是不是意味着大概率录用?哪位有过本刊物投稿经验的同仁可以给分析下,承蒙帮助,不胜感激,
254	投稿	文章啥时候能投出去矮快点被期刊接收吧
255	第一次自己投paper	至今一直是witheditor,间隔多久催稿合适呢?
256	投稿了Elsevier的Image and Vision Computing一周后直接Decision in Process	第一投英文不达标,然后用Elsevier的润色服务修改了,第二次投,结果一周后就直接DecisioninProcess了。这种情况是不是被直接拒绝的概率大,DecisioninProcess几天后可以考虑催稿。在其他地方有看到两周或一个月直接中的,请问有人一周就中的吗,是第一次直接投期刊写的特别好直接中了,还是会议扩充所以直接中了。我的论文是CCFB类ICASSP已经接收的论文,计算机视觉方面,4页扩充到15页,有希望中吗?
257	材料相关ei国际会议	最近有哪些关于材料冶金方面的国际ei会议吗,快毕业了还没有论文,想找一个好投的
258	有知道电力系统及其自动化学报期刊的吗	投了一篇该期刊的论文,等了大概有20天了,状态是专家审核中,有虫友知道这个期刊难度怎么样吗?审稿一般多久给回复呀,审稿周期长吗?只投了这一个期刊的,初来木虫,希望虫友帮忙解答,感激不尽
259	energy storage materials投稿,Required Reviews Completed一周了	RequiredReviewsCompleted状态一周了还没有变化,虽然投了好多次文章了,但是还是一天看七八次,焦急得很,想年前能够接收,问一下大家你们这个状态一般要好久啊?
260	eproofing修改求助。	thepagesarenotnumberedbutthelinesare,toeasereferencetoanypassagetobecorrected这句话什么意思?
261	关于HINDAWI一个期刊的状态是PENDING APPROVAL,是啥情况?	前段时间投稿hindawi一个期刊,经过两轮审稿后,目前状态是pendingapproval,前两天编辑发来信息说处于稿件质量检查qualitychecker阶段,请问后续打算是录用吗?这篇论文对我很重要。投稿HINDAWI的虫友,出来聊下。
262	求推荐一家核心	手上有一篇论文,人脸识别方面的,想投一个比较容易中的核心期刊,求推荐
263	投稿IOP旗下期刊一个月后awaiting decision后又变成awaiting referee repo	投稿的IOP旗下的NuclearFsuion期刊,一般都是两个审稿人,2022年1月16号投稿,投稿几天后我就收到另一篇该杂志的审稿邀请,给了我20天时间审稿。我2月16号前天把审稿意见投回去,2月17号昨天我看那篇文章编辑部给了中修,然后突然发现我自己文章变成awaitingdecision了,等到今天我的文章又变成awaitingrefereerepo了,到底是什么情况啊?下面两张图一个是昨天等待决定的IOP系统查询结果,另一张是今天变成awaitingrefereerepo的查询结果,请问一下我这个是在找仲裁了吗?我算了一下时间,1月16号投稿后我一直在IOP查询系统查询审稿人是...
264	请问投Journal of enzyme inhibition and medicinal chemistry时间久吗?	请问投Journal of enzyme inhibition and medicinal chemistry时间久吗?
265	投了中国公路学报  这是什么情况?	投了中国公路学报  这是什么情况?
266	期刊投稿级别求助	TIFS/IEEETransactionsonInformationForensicsandSecurity想请问一下,信息安全专业,这个期刊是非常厉害的期刊吗
267	有没有一个可以搜索SCI Special Issue的地方	发现错过好多specialissue,这些好像都是小圈子人搞的,好多人都不知道就截稿完毕了
268	with editor很久不送审	请问有人近期投geoderma吗?witheditor十几天了,这么长时间不送审是不是要凉了
269	投稿期刊Energy,编辑退回提交,说需要提供doc文件以统计字数?	大佬们,投稿第一次遇到这样的问题。Pleaseprovidethedocfileofyourmanuscriptundeheitemtype&quot;Latexsourcefile&quot;,itwouldbehelpfulforustocheckthewordcountofyourmanuscript.Pleaseedit.需要再写一份word嘛?
270	jrr期刊投稿	请问有人投过jrr期刊吗,机械工程师系列paO部分的,现在peerreviewinprogress,请问是外审吗
271	JCR2区  材料工程类 SCI期刊 咨询	请问大家可以帮忙推荐几个JCR2区的SCI期刊吗?材料加工类方向审稿速度快一些,容易一些的,收费期刊也ok的,
272	论文纠错	请问ieee已发表的论文有错误,纠错的话需要额外的版面费吗
273	请问各位电力系统有没有比较好中的二区sci	小弟写的是电力系统规划方面的论文,之前投了IEEEpowersystem,smagrid和sustainableenergy都被拒。大概三分之一的审稿专家要求reject,三分之二修改,论文质量应该不至于很差很差。所以想请教各位有没有比较好中的、认可度还可以的二区期刊,着急今年申phd用,谢谢了。
274	with journal administrator 一个半月	taylorfrancis系统,投稿journalofeahquakeengineering,一个半月了,状态一直是withjournaladministrator,这是什么情况,着急毕业,有类似经历的帮忙分析分析?谢谢
275	Production Editor的回复,不知道什么意思	本人8月17日在Springer的NeuralComputingandApplication中了一篇文章,但至今都没有收到proof文件。发邮件咨询了ProductionEditor,他回复说OursystemindicatesthattheMyPublicationformsofyouraiclehasbeenopenedbythecorrespondingauthorforcompletion.Oncetheformsaresubmitted,youwillbereceivingtheeprooflinkofyouraicle.可是在投稿系统里也找不到这个表格有在这篇期刊上中稿的...
276	本科生投核心难吗	本科生写了篇岩土类论文,老板说写的还可以让投了某中文EI期刊,然后被退稿,怎么办??????
277	投稿IET Control Theory  Applications需要latex模板吗?word可以吗?	投稿IETControlTheoryApplications需要latex模板吗?word可以吗?如果需要latex,还请帮忙提供下latex模板,
278	Angew重投一个多月了 还没消息	Angew审稿意见一个拒,一个修改。编辑给了重投的机会,修改之后已经投了5个星期了,一点消息都没有,着各位怎么看啊
279	投稿《岩土力学》	投稿《岩土力学》送两个外审,第一个天就审完了。。。不知是福还是祸请各位大神指点迷津!图片1.png
280	光学精密工程版面费问题	请问光学精密工程期刊版面费怎么收取,是正式录取通知下达之后收取吗?我收到了一个录用通知(非正式)以及一个版面费缴纳通知(没写金额)里面说一周内缴纳.
281	加密算法硬件实现相关期刊求助	请问大家《AES和SM4加密协处理器》这类文章,有哪些比较容易中的英文期刊呢?国内国外都可,只要容易中就可以了,对影响因子不要求,满足毕业就可以。
282	Accepted  Pending R Badge	AcceptedPendingRBadge不会上传代码到codeocean,可不可以给主编说一说不上传啊
283	Reproduction in Domestic Animals	ReproductioninDomesticAnimals请问这个杂志在JCR国际分区是几区
284	投稿期刊求推荐	小弟研究方向是超声检测中的数据压缩,想找个好发的EI源刊求个毕业,之前看了MPDI下的information和algorithm,但是最近涨价到一万了,而且看了里头的文章感觉质量也挺高的,心里没谱。求各位老哥老姐们推荐个好中的期刊,开源的也行,快救救孩子吧
285	管科方向哪些期刊的审稿周期比较短	问一下大家管理科学与工程方向有哪些期刊的审稿周期比较快,求毕业???
286	求助	CoS和CoO的xrd吸收峰在多少度?哪个大神可以指点一下
287	自动化学报审稿	研一刚写完一篇论文,投在了自动化学报上,等待了5天了,一直是等待编辑处理状态,是怎么回事,正常吗?
288	IEEE Trans on Robotics 有一个decision 的deadline,请问一定是按照的吗?	投稿系统说明3个月给结果,而且还给出一个deadline,就是投稿之后的3个月,好奇一定给结果吗?
289	《机械传动》期刊	有投过这个期刊的没?怎样?
290	求助	有谁能帮我看到你的PDF:04~022~8399卡片吗,有偿
291	稿件已审完,编辑一个多月还没给决定,如何处理?	向爱思唯尔下的期刊(SignalProcessing)投了一篇论文,投稿日期18Feb2022,稿件在26Feb2022很快更新了状态RequiredReviewsCompleted。但是到现在都一个多月了,编辑还没有给决定。这是什么情况。之前总投IEEE的期刊,编辑一般能很快给决定,但是第一次投爱思唯尔的期刊。对此不是很了解,望有经验的高手分享一下经验。非常感谢!
292	投稿状态	有人知道foodpackagingandshelflife的送审流程吗,我的投的submittedtojournal两周后witheditor了,但witheditor后每周都变了次日期变了两次,但状态没变是为啥呢等的好焦急
293	NPJ新期刊Communication Materials怎么样?前景如何?	做了个材料类的论文,投了Naturecommunications试试,编辑让转投CommunicationMaterials,我查了下是2019年底的新刊,网上说nature旗下的Communication系列的期刊都有很好的前景可以投资,大家觉得这个CM怎么样呢,有投过的吗?
294	ISME J期刊投稿经验	ISMEJ期刊投稿经验多久说明到审稿人手里了呀?
295	长江科学院院报投稿流程求助	外审2天左右就结束了,进入到主编审核,请问各位大佬们,这是外审通过,还是没有通过,有经验的求指导。)D{IBDFD5DVN3DZOL9HC}UT.png
296	投稿后发现错误	投稿后,已经在评审了,但是发现有两处错误,第一个,每个公式后面的序号在原有基础上都加了一,第二个,有个单词的单复数写错了。怎么办?投稿系统上也没有修改稿件的选项?谢谢各位了
297	author conflicts信息缺失怎么办呀!!	前天sigir截稿,我提交的版本没有authorconflicts信息,上面authorconflicts显示的none,作者邮箱后缀倒是有学校机构信息(但也不全),这个影响大嘛?会被deskrej嘛?现在要怎么做呀?好慌呀,感觉自己犯了这么蠢的问题可太难受了。目前,刚用邮箱给大会发邮件,看能否添加,邮箱不是投稿的邮箱,也没有告知自身信息。还想问下,如果我把个人信息发给大会,违反双盲嘛?有必要实名问嘛?
298	如何修改 ACS LaTeX 模板中最后一页标题 Graphical TOC Entry	ACSphotonics如何把ACSLaTeX模板中最后一页标题GraphicalTOCEntry修改标为ForTableofContentsUseOnly,以及将图片描述写在TOC框外?
299	FGCS期刊可以用word提交吗?	想知道期刊《futuregenerationcomputersystem》能提交word版吗?格式是什么?
300	求RSC的Chemical Communication投稿须知和模版	请问大佬们,谁有RSC的ChemicalCommunication投稿须知和模版,可以分享下吗?
301	Frontiers Authors proof	FrontiersinOncologyAuthorsproof阶段发现补充材料上传错了一个,还能去掉这个错误的补充材料么?
302	materials and structures有人投过吗	materials and structures有人投过吗
303	International journal of quantum chemistry投稿状态求助	各位同学大家好,本人小硕一枚,初投Wiely旗下的Internationaljournalofquantumchemistry期刊,从投稿到到现在半个月了,一直是Underreview,从没变过,想请教一下有经验的小伙伴,这个状态大概会持续多长时间?
304	RESS给了大修,请教润色事。	最近RESS返回意见给了大修,4个审稿人,一个只是让添加一个时间指标,其他的没说啥。另外三个表示研究很interesting,也提了若干条意见。另外提到了语言的问题,第一次提交的手稿已经是我英文水平的巅峰了,所以想请教下关于润色的事,在爱思唯尔润色怎么样?润色后是否有证明,在提交修改稿的时候是否可以将润色证明一同提交?
305	关于Journal of Navigation 期刊的投稿的问题咨询	在JournalofNavigation期刊投了一篇论文,编辑最近发来邮件Yourpaperhasbeenrecommendedforacceptancebythereviewteam.Inowneedtoeditandassessitagainstotherpapersvyingforspaceinthejournal,andtodothis,IneedaversioninMSWORDformat.这是什么意思,是接收了吗?为什么稿件状态还是UnderReview?有些不确定,发了邮件询问,然后主编给我的回复是Thankyoufohis.PleasebecleahatIhavenot...
306	under review 一周后变成reviewer(s) invited	是说明原来的审稿人拒绝审稿吗。我之前用导师的审稿人账号看见好像有的爱斯维尔期刊是一个审稿人审完再送下一个。这种情况真实存在吗,还是说就是简单的,审稿人没时间。但是我想,状态这样变,不可能所有审稿人都同时没时间啊,难道真的是,一个一个送审?
307	materials  and  design  编辑有点让人无语	materials  and  design  编辑有点让人无语
308	投Mathematical Problems in Engineering,七天了没分Editor	RT一周了,一直没分配editor,就在第三天发了个邮件要求确认下论文数据声明。这是声明情况?有大佬遇到过吗?请释疑。
309	ICRA2022投稿问题	ICRA会议论文提交时必须提交视频吗?不提交是不是中不了
310	投稿一个月一直是with journal administrator,应该怎么办呢?	投稿一个月一直是withjournaladministrator,连witheditor都不是是Taylor&Francis旗下的期刊,不能直接联系期刊编辑,只能联系到Taylor的办公室之类的,邮件回复倒是挺快,但是就是一些套话,请问有人遇到类似的情况吗?应该怎么办呢?
311	版面费只收到一部分?	版面费只收到一部分?
312	Applied Intelligence被接受后怎么提交源文件	急急被AppliedIntelligence编辑发来邮件说无法编辑PDF,需要提供原始latex和图片文件。但是通过添加附件回复邮件形式被退回。退回说明是邮件大小超过服务器限制(文件已通过压缩软件压缩到2.4M)。各位大神有没有遇到过,该怎么发过去啊?
313	这个后面复审是给哪里审?	请问后面的流程是怎么个流程法?小白第一次投稿,望大神解答
314	Energy Storage Materials大修返回稿第2天变Required Reviews Completed,要多久呢	三个审稿人一个大修,两个小修,修改稿返回第二天就变成审稿结束状态,这个是再等其它审稿人回复的意思吗?
